{
  "$schema": "https://json-schema.org/draft/2020-12/schema",
  "$id": "https://sah.dev/schemas/design-strategy/v0.1.0",
  "title": "SAH Design Strategy IR",
  "type": "object",
  "additionalProperties": false,
  "required": ["schemaVersion", "modelId", "characterizationRef", "selections", "compositionSeams", "shortPath"],
  "properties": {
    "schemaVersion": {"const": "0.1.0", "x-sah-trace": {"writtenBy": ["S2"], "readBy": ["schema-validator", "S13"]}},
    "modelId": {"$ref": "#/$defs/id", "x-sah-trace": {"writtenBy": ["S2"], "readBy": ["S3", "S4", "S6", "S13"]}},
    "characterizationRef": {"$ref": "#/$defs/id", "x-sah-trace": {"writtenBy": ["S2"], "readBy": ["reference-validator", "S3", "S4"]}},
    "selections": {"type": "array", "items": {"$ref": "#/$defs/selection"}, "minItems": 1, "x-sah-trace": {"writtenBy": ["S2"], "readBy": ["S3", "S4", "S6", "S7", "benchmark-judge"]}},
    "compositionSeams": {"type": "array", "items": {"$ref": "#/$defs/compositionSeam"}, "x-sah-trace": {"writtenBy": ["S2"], "readBy": ["S3", "S4", "S5", "S6"]}},
    "shortPath": {"$ref": "#/$defs/shortPath", "x-sah-trace": {"writtenBy": ["S2"], "readBy": ["S3", "S8", "ceremony-validator"]}}
  },
  "$defs": {
    "id": {"type": "string", "pattern": "^[a-z][a-z0-9]*(?:-[a-z0-9]+)*$"},
    "strategy": {"type": "string", "pattern": "^[a-z][a-z0-9]*(?:-[a-z0-9]+)*$"},
    "rationale": {
      "type": "object", "additionalProperties": false,
      "required": ["dimensionIds", "evidenceRefs", "text"],
      "properties": {
        "dimensionIds": {"type": "array", "items": {"enum": ["rule_change_complexity", "invariant_criticality", "dataflow_orientation", "distribution_consistency", "concurrency_temporality", "autonomy_uncertainty", "integration_volatility", "scale_performance", "assurance_governance", "change_isolation"]}, "minItems": 1, "x-sah-trace": {"writtenBy": ["S2"], "readBy": ["strategy-trace-validator", "benchmark-judge"]}},
        "evidenceRefs": {"type": "array", "items": {"$ref": "#/$defs/id"}, "minItems": 1, "x-sah-trace": {"writtenBy": ["S2"], "readBy": ["trace-validator", "S9"]}},
        "text": {"type": "string", "minLength": 1, "x-sah-trace": {"writtenBy": ["S2"], "readBy": ["S3", "S4", "human-reviewer"]}}
      }
    },
    "alternative": {
      "type": "object", "additionalProperties": false,
      "required": ["strategy", "benefits", "costs", "rejectedBecause", "reversalEvidence"],
      "properties": {
        "strategy": {"$ref": "#/$defs/strategy", "x-sah-trace": {"writtenBy": ["S2"], "readBy": ["S9", "benchmark-judge"]}},
        "benefits": {"type": "array", "items": {"type": "string", "minLength": 1}, "minItems": 1, "x-sah-trace": {"writtenBy": ["S2"], "readBy": ["S9"]}},
        "costs": {"type": "array", "items": {"type": "string", "minLength": 1}, "minItems": 1, "x-sah-trace": {"writtenBy": ["S2"], "readBy": ["S9", "benchmark-judge"]}},
        "rejectedBecause": {"type": "string", "minLength": 1, "x-sah-trace": {"writtenBy": ["S2"], "readBy": ["S9", "benchmark-judge"]}},
        "reversalEvidence": {"type": "string", "minLength": 1, "x-sah-trace": {"writtenBy": ["S2"], "readBy": ["S13"]}}
      }
    },
    "selection": {
      "type": "object", "additionalProperties": false,
      "required": ["subsystemRef", "dominantStrategy", "supportingStrategies", "rationale", "alternatives", "disqualifiers", "costs", "confidence"],
      "properties": {
        "subsystemRef": {"$ref": "#/$defs/id", "x-sah-trace": {"writtenBy": ["S2"], "readBy": ["reference-validator", "S3", "S4", "S6"]}},
        "dominantStrategy": {"$ref": "#/$defs/strategy", "x-sah-trace": {"writtenBy": ["S2"], "readBy": ["S3", "S4", "S6", "S7", "benchmark-judge"]}},
        "supportingStrategies": {"type": "array", "items": {"$ref": "#/$defs/strategy"}, "uniqueItems": true, "x-sah-trace": {"writtenBy": ["S2"], "readBy": ["S3", "S4", "S6"]}},
        "rationale": {"$ref": "#/$defs/rationale", "x-sah-trace": {"writtenBy": ["S2"], "readBy": ["S3", "S4", "S9"]}},
        "alternatives": {"type": "array", "items": {"$ref": "#/$defs/alternative"}, "minItems": 1, "x-sah-trace": {"writtenBy": ["S2"], "readBy": ["S9", "benchmark-judge"]}},
        "disqualifiers": {"type": "array", "items": {"type": "string", "minLength": 1}, "x-sah-trace": {"writtenBy": ["S2"], "readBy": ["S3", "S4", "S13"]}},
        "costs": {"type": "array", "items": {"type": "string", "minLength": 1}, "minItems": 1, "x-sah-trace": {"writtenBy": ["S2"], "readBy": ["S9", "benchmark-judge"]}},
        "confidence": {"type": "number", "minimum": 0, "maximum": 1, "x-sah-trace": {"writtenBy": ["S2"], "readBy": ["S9", "S10"]}}
      }
    },
    "compositionSeam": {
      "type": "object", "additionalProperties": false,
      "required": ["id", "fromSubsystemRef", "toSubsystemRef", "reason", "concerns", "evidenceRefs", "unresolvedQuestions"],
      "properties": {
        "id": {"$ref": "#/$defs/id", "x-sah-trace": {"writtenBy": ["S2"], "readBy": ["reference-validator", "S6"]}},
        "fromSubsystemRef": {"$ref": "#/$defs/id", "x-sah-trace": {"writtenBy": ["S2"], "readBy": ["reference-validator", "S3", "S5", "S6"]}},
        "toSubsystemRef": {"$ref": "#/$defs/id", "x-sah-trace": {"writtenBy": ["S2"], "readBy": ["reference-validator", "S3", "S5", "S6"]}},
        "reason": {"type": "string", "minLength": 1, "x-sah-trace": {"writtenBy": ["S2"], "readBy": ["S3", "S5", "S6"]}},
        "concerns": {"type": "array", "items": {"type": "string", "minLength": 1}, "minItems": 1, "x-sah-trace": {"writtenBy": ["S2"], "readBy": ["S3", "S4", "S6"]}},
        "evidenceRefs": {"type": "array", "items": {"$ref": "#/$defs/id"}, "minItems": 1, "x-sah-trace": {"writtenBy": ["S2"], "readBy": ["trace-validator", "S3", "S4"]}},
        "unresolvedQuestions": {"type": "array", "items": {"type": "string", "minLength": 1}, "x-sah-trace": {"writtenBy": ["S2"], "readBy": ["S3", "S4", "S5", "S6"]}}
      }
    },
    "shortPath": {
      "type": "object", "additionalProperties": false,
      "required": ["eligible", "rationale", "disqualifyingForces"],
      "properties": {
        "eligible": {"type": "boolean", "x-sah-trace": {"writtenBy": ["S2"], "readBy": ["S3", "S8", "ceremony-validator"]}},
        "rationale": {"type": "string", "minLength": 1, "x-sah-trace": {"writtenBy": ["S2"], "readBy": ["human-reviewer", "benchmark-judge"]}},
        "disqualifyingForces": {"type": "array", "items": {"type": "string", "minLength": 1}, "x-sah-trace": {"writtenBy": ["S2"], "readBy": ["S3", "S4", "S13"]}}
      }
    }
  },
  "examples": [{
    "schemaVersion": "0.1.0",
    "modelId": "catalog-admin-strategy",
    "characterizationRef": "catalog-admin-characterization",
    "selections": [{
      "subsystemRef": "catalog-admin",
      "dominantStrategy": "transaction-script-modular",
      "supportingStrategies": [],
      "rationale": {"dimensionIds": ["rule_change_complexity", "invariant_criticality"], "evidenceRefs": ["ev-product-edit"], "text": "Independent record changes and local validation favor direct operations"},
      "alternatives": [{"strategy": "responsibility-centered-domain", "benefits": ["Room for richer rules"], "costs": ["Modeling ceremony"], "rejectedBecause": "No interacting rules are evidenced", "reversalEvidence": "Rules begin coordinating product changes"}],
      "disqualifiers": ["A critical invariant spans products"],
      "costs": ["Behavior may scatter if rules grow"],
      "confidence": 0.9
    }],
    "compositionSeams": [],
    "shortPath": {"eligible": true, "rationale": "Local reversible CRUD with no critical invariant", "disqualifyingForces": ["Distribution", "cross-record invariant", "probabilistic autonomy"]}
  }]
}
